{
  "$schema": "https://json-schema.org/draft/2020-12/schema",
  "$id": "https://detran.example.invalid/schemas/module-blueprint.schema.json",
  "title": "DETRAN module blueprint",
  "type": "object",
  "required": ["schemaVersion", "id", "module", "database"],
  "properties": {
    "schemaVersion": {
      "const": "1.0.0"
    },
    "id": {
      "type": "string",
      "pattern": "^BP-[A-Z0-9-]+$"
    },
    "module": {
      "type": "object",
      "required": ["name", "namespace", "version"],
      "properties": {
        "name": {
          "type": "string"
        },
        "namespace": {
          "type": "string",
          "pattern": "^[a-z][a-z0-9-]*$"
        },
        "version": {
          "type": "string"
        },
        "handwrittenControllers": {
          "type": "array",
          "items": {
            "$ref": "#/$defs/handwrittenModuleMember"
          }
        },
        "handwrittenProviders": {
          "type": "array",
          "items": {
            "$ref": "#/$defs/handwrittenModuleMember"
          }
        },
        "handwrittenExports": {
          "type": "array",
          "items": {
            "type": "string"
          }
        },
        "owners": {
          "type": "array",
          "items": {
            "type": "string"
          }
        },
        "description": {
          "type": "string"
        },
        "moduleImports": {
          "type": "array",
          "items": {
            "type": "object",
            "required": ["package", "symbol"],
            "properties": {
              "package": {
                "type": "string"
              },
              "symbol": {
                "type": "string"
              }
            }
          }
        },
        "moduleExports": {
          "type": "array",
          "items": {
            "type": "string"
          }
        }
      }
    },
    "database": {
      "type": "object",
      "required": ["entities"],
      "properties": {
        "entities": {
          "type": "array",
          "items": {
            "$ref": "#/$defs/entity"
          }
        }
      }
    },
    "api": {
      "type": "object"
    },
    "auth": {
      "type": "object"
    },
    "audit": {
      "type": "object"
    },
    "ops": {
      "type": "object"
    }
  },
  "$defs": {
    "handwrittenModuleMember": {
      "type": "object",
      "required": ["target", "symbol"],
      "properties": {
        "target": {
          "type": "string"
        },
        "symbol": {
          "type": "string"
        }
      }
    },
    "entity": {
      "type": "object",
      "required": ["name", "table", "primaryKey", "fields"],
      "properties": {
        "name": {
          "type": "string"
        },
        "table": {
          "type": "string"
        },
        "primaryKey": {
          "type": "array",
          "items": {
            "type": "string"
          }
        },
        "applicationAppendOnly": {
          "type": "boolean"
        },
        "fields": {
          "type": "array",
          "items": {
            "type": "object",
            "required": ["name", "type"],
            "properties": {
              "name": {
                "type": "string"
              },
              "type": {
                "type": "string"
              },
              "nullable": {
                "type": "boolean"
              },
              "default": {},
              "writable": {
                "type": "boolean"
              },
              "pii": {
                "type": "string"
              },
              "retention": {
                "type": "string"
              },
              "jsonSchema": {
                "$ref": "#/$defs/jsonFieldSchema"
              }
            }
          }
        },
        "relations": {
          "type": "array"
        },
        "indexes": {
          "type": "array"
        }
      }
    },
    "jsonFieldSchema": {
      "type": "object",
      "required": ["type"],
      "additionalProperties": false,
      "properties": {
        "type": {
          "enum": ["array", "object", "string", "integer", "number", "boolean"]
        },
        "items": {
          "$ref": "#/$defs/jsonFieldSchema"
        },
        "properties": {
          "type": "object",
          "additionalProperties": {
            "$ref": "#/$defs/jsonFieldSchema"
          }
        },
        "required": {
          "type": "array",
          "items": { "type": "string" }
        },
        "additionalProperties": { "type": "boolean" },
        "format": { "type": "string" },
        "enum": { "type": "array" },
        "minItems": { "type": "integer", "minimum": 0 },
        "minLength": { "type": "integer", "minimum": 0 },
        "maxLength": { "type": "integer", "minimum": 0 },
        "minimum": { "type": "number" }
      },
      "allOf": [
        {
          "if": { "properties": { "type": { "const": "array" } } },
          "then": { "required": ["items"] }
        },
        {
          "if": { "properties": { "type": { "const": "object" } } },
          "then": { "required": ["properties"] }
        }
      ]
    }
  }
}
